{
  "schema": "nsc-frontier-updates-v1",
  "observed_at": "2026-09-11",
  "policy": "External papers are source-reported until independently reviewed by the Commons. Each update must state both consequence and non-consequence.",
  "updates": [
    {
      "id": "FU-2026-09-09-CAO-CHI-TORUS",
      "date": "2026-09-09",
      "title": "Distribution of Singular Data Generated by Compact Forced Navier-Stokes Blowup",
      "authors": [
        "Shaozhen Cao",
        "Zhuoni Chi"
      ],
      "url": "https://arxiv.org/abs/2609.10262v1",
      "source_id": "cao-chi-torus-2609.10262",
      "evidence_state": "source-reported-external-unreviewed",
      "affects_programs": [
        "NS-M03",
        "NS-M04",
        "NS-M06"
      ],
      "reported_result": "For fixed viscosity/time horizon on T^3, smooth forces producing classical breakdown from rest are dense in the inherited time-integrated spatial H^s topology iff s<1/2, with further fixed-initial-velocity/mixed-norm/interior results.",
      "does_not_establish": [
        "fixed-force instability",
        "classification of singular initial velocities for one prescribed force",
        "unforced A/B",
        "independent verification of OpenAI C/D"
      ],
      "frontier_effect": "Upgrades varying-force abundance from speculation to a concrete externally reported theorem; sharpens which stability/genericity questions remain genuinely open."
    },
    {
      "id": "FU-2026-09-09-CAO-CHI-R3",
      "date": "2026-09-09",
      "title": "Singular Forces on the Whole Space: Sobolev Density Thresholds and Energy Approximation",
      "authors": [
        "Shaozhen Cao",
        "Zhuoni Chi"
      ],
      "url": "https://arxiv.org/abs/2609.10269v1",
      "source_id": "cao-chi-r3-2609.10269",
      "evidence_state": "source-reported-external-unreviewed",
      "affects_programs": [
        "NS-M03",
        "NS-M04",
        "NS-M06",
        "NS-M08"
      ],
      "reported_result": "On R^3, singular forces are reported dense in relative L1_t H^s_x iff s<1/2 and in relative L2_t H^s_x iff s<-1/2, preserving fixed smooth initial velocity and approximating energy/dissipation.",
      "does_not_establish": [
        "fixed-force instability",
        "loss of weak existence",
        "unforced A/B",
        "new formal verification"
      ],
      "frontier_effect": "Supplies concrete force-space thresholds and numerical/energy approximation targets while leaving fixed-force and unforced questions open."
    }
  ]
}
